,Job Title,Description
0,Frontend Developer,"As a Frontend Developer, you'll focus on creating user-friendly and visually appealing web interfaces. Key responsibilities include implementing responsive designs, interactive features, and user experiences. Proficiency in HTML, CSS, JavaScript, and modern frontend frameworks like React, Angular, or Vue.js is essential. Tech Stack: HTML, CSS, JavaScript, React/Angular/Vue.js, UI/UX Design"
1,Backend Developer,"As a Backend Developer, your primary role is to design, develop, and optimize server-side applications. Responsibilities include building efficient server logic, managing databases, and implementing APIs. Proficiency in languages like Python, Java, or Node.js, along with experience in SQL or NoSQL databases and frameworks like Django or Express.js, is crucial. Tech Stack: Python, Java, Node.js, SQL/NoSQL Databases, Django, Express.js"
2,Marketing Manager,"Develop comprehensive marketing strategies, encompassing digital marketing, content marketing, SEO, PPC advertising, and social media. Manage a team of marketing professionals, setting clear goals, conducting performance evaluations, and providing guidance and mentorship. Analyze marketing data and metrics, utilizing tools like Google Analytics and CRM systems to evaluate campaign effectiveness, adjust strategies, and make data-driven decisions"
3,Customer Service Representative,"Address customer inquiries and issues via phone, email, and chat, providing accurate and helpful information with a focus on first-call resolution. Resolve customer complaints and escalations, ensuring a positive customer experience and maintaining a high level of customer satisfaction. Keep detailed records of customer interactions and feedback, regularly sharing insights with the team to enhance customer service processes"
4,Data Analyst,"Analyze large datasets to extract meaningful insights, trends, and patterns, using statistical and data visualization tools (e.g., Python, R, Tableau). Develop and maintain reporting and dashboard solutions, creating actionable visualizations and presenting data-driven recommendations to various stakeholders. Collaborate with business teams to identify data needs, gather requirements, and provide ongoing support for data-related inquiries"
5,Graphic Designer,"Create visual assets for marketing materials, websites, and branding campaigns, ensuring a consistent and visually appealing design that aligns with the company's brand guidelines. Collaborate closely with the marketing team to understand project requirements, conduct design research, and deliver creative designs that meet both aesthetic and functional requirements. Stay updated on design trends and tools, incorporating them into your work while actively seeking feedback and critique from colleagues and stakeholders"
6,Financial Analyst,"Analyze financial data to support strategic planning and decision-making, including financial modeling, budgeting, forecasting, and variance analysis. Prepare financial statements, tax returns, and financial reports for internal and external stakeholders, ensuring compliance with relevant accounting standards. Collaborate with various departments to understand financial needs, including cost reduction opportunities and investment analysis, and provide valuable budgetary recommendations"
7,HR Generalist,"Manage the end-to-end recruitment process, including sourcing candidates, conducting interviews, and facilitating the onboarding process, ensuring a smooth transition for new hires. Handle employee relations, including conflict resolution, disciplinary actions, and performance management, and maintain accurate employee records. Administer HR policies, procedures, and benefits, ensuring legal compliance and addressing questions and concerns from employees regarding HR matters"
8,Sales Representative,"Prospect and qualify potential customers through lead generation, market research, and customer profiling, building and maintaining a robust sales pipeline. Deliver persuasive sales pitches, product demonstrations, and presentations to close deals and meet sales targets. Build and maintain strong customer relationships, providing post-sale support and ensuring long-term customer satisfaction while seeking opportunities for upselling and cross-selling"
9,Project Manager,"Plan and execute projects, defining scope, goals, deliverables, risks, and constraints while establishing detailed project plans, timelines, and budgets. Coordinate project teams, assigning tasks, monitoring progress, and communicating effectively with team members and stakeholders to ensure projects are completed on time and within budget. Identify and mitigate project risks, proactively solving issues and roadblocks, and reporting project status through regular updates and presentations to key stakeholders"
10,Content Writer,"Create engaging and informative content for various platforms, including blog posts, articles, web content, ebooks, and whitepapers, conducting thorough research and adhering to established content strategies. Optimize content for SEO, incorporating relevant keywords and meta tags, and collaborate with SEO experts to drive organic traffic and increase search engine rankings. Seek feedback and work collaboratively with editors, designers, and content strategists to ensure content aligns with the target audience and delivers value"
11,Accountant,"Manage financial records and accounts, recording and reconciling financial transactions, including accounts payable, accounts receivable, and general ledger entries. Prepare accurate financial statements, tax returns, and financial reports, staying updated on tax laws and accounting standards to ensure compliance. Collaborate with internal and external audit teams and tax professionals, assisting with audits and tax filings, and providing financial information and documentation as needed"
12,IT Support Specialist,"Provide technical support to employees, troubleshooting and resolving hardware and software issues, including installation, configuration, and maintenance of computer systems, software, and peripherals. Maintain and configure computer systems and networks, performing regular updates, patches, and backups, and ensuring data security and system stability. Educate users on technology best practices, conducting training sessions, and providing resources to help employees effectively use technology to enhance their productivity"
13,Legal Counsel,"Provide legal advice and support on various matters, including contracts, regulations, compliance, and dispute resolution, conducting legal research, and drafting legal documents, contracts, and agreements. Review, negotiate, and redline contracts, ensuring the company's interests are protected and legal risks are minimized. Stay informed about changes in laws and regulations affecting the company, proactively monitoring legal developments and providing guidance on legal compliance, risk management, and business strategy"
14,Social Media Manager,"Develop and execute social media strategies to increase brand awareness, engage with followers, and drive traffic to the company's website, managing social media content calendars, scheduling posts, and monitoring social media performance. Create and curate content for various social media platforms, including Facebook, Twitter, Instagram, LinkedIn, and emerging platforms. Monitor social media performance and adjust strategies based on analytics data, identifying trends, and proposing improvements to maximize engagement and reach target audience goals"
15,Quality Assurance Tester,"Test software applications for functionality, performance, and usability, identifying and documenting defects using comprehensive testing methodologies, including manual and automated testing. Collaborate with developers and quality assurance engineers to ensure timely resolution of reported defects and to facilitate retesting. Develop detailed test plans, test cases, and test scripts for new and existing software products, and conduct regression testing to ensure the integrity of existing functionalities and features"
16,Nurse,"Provide healthcare services and support to employees, including first aid, basic medical care, and triage in case of medical emergencies. Coordinate with healthcare providers, insurance companies, and medical facilities, ensuring employees have access to necessary medical services and healthcare resources. Implement and manage employee health and wellness programs, offering health education and promoting preventive care to improve overall employee well-being and health"
17,Supply Chain Manager,"Oversee all aspects of the supply chain, including procurement, inventory management, demand forecasting, and logistics. Optimize inventory levels and supply chain processes to meet demand while minimizing carrying costs and maintaining stock accuracy. Collaborate with suppliers, distributors, and internal teams to ensure a smooth flow of goods and materials, implementing supply chain strategies that enhance operational efficiency and reduce costs"
18,UX/UI Designer,"Design user interfaces that are intuitive, user-friendly, and aesthetically pleasing, conducting user research, usability testing, and user interviews to inform design decisions. Create wireframes, prototypes, and high-fidelity mockups, and work closely with developers to implement designs and ensure that the final product meets design and user experience standards. Collaborate with product managers and stakeholders to ensure that designs align with business objectives, user needs, and the product's overall vision"
19,Customer Success Manager,"Ensure customer satisfaction and retention by building strong relationships with clients, understanding their needs and goals, and providing exceptional support and value. Proactively monitor customer accounts, addressing customer concerns and resolving issues in a timely manner, and identifying opportunities for upselling and cross-selling. Analyze customer data and trends, providing insights to the sales and product development teams, and advocating for customer needs and feedback"
20,Environmental Specialist,"Monitor and assess the company's environmental impact and regulatory compliance, conducting environmental assessments, audits, and sustainability evaluations. Develop and implement sustainability initiatives, including waste reduction, energy efficiency, and resource conservation, and ensure the company's compliance with environmental standards, permits, and regulations. Collaborate with environmental agencies, partners, and industry experts to share best practices, remain informed about changing regulations, and drive the company's commitment to environmental responsibility"
21,Mechanical Engineer,"Design and develop mechanical systems and products, ensuring they meet safety, quality, and performance standards, and collaborating with cross-functional teams to translate project requirements into feasible designs. Conduct simulations, tests, and analyses to evaluate the performance of mechanical components, making data-driven design improvements as necessary. Stay updated on industry trends, emerging technologies, and best practices, integrating this knowledge into your work and fostering a culture of innovation within the engineering team"
22,Research Scientist,"Conduct research and experiments in a specific field, collecting and analyzing data, conducting literature reviews, and maintaining detailed laboratory records. Collaborate with other scientists and researchers to advance scientific knowledge and achieve research goals, including designing and executing experiments, generating hypotheses, and publishing research findings in peer-reviewed journals. Present research findings at conferences, participate in grant applications, and seek opportunities for scientific collaboration, networking, and interdisciplinary research"
23,Event Planner,"Organize and execute corporate events and conferences, from concept development to post-event evaluation, managing all aspects, including event budgeting, scheduling, vendor selection, and logistics. Ensure a seamless event experience for attendees, coordinating with external partners, venues, and suppliers to guarantee the event's success. Develop and manage event budgets, conducting cost-benefit analyses, and optimizing resources to deliver events within budget constraints while tracking and reporting event metrics and KPIs"
24,Digital Marketing Specialist,"Execute digital marketing campaigns across various channels, such as social media, email marketing, pay-per-click (PPC) advertising, and search engine optimization (SEO). Monitor and analyze online marketing performance using tools like Google Analytics, Google Ads, and marketing automation platforms, optimizing campaigns to increase conversion rates, traffic, and ROI. Develop and optimize landing pages, conversion funnels, and email marketing campaigns, collaborating with web developers, designers, and copywriters to enhance online engagement and drive sales"
25,Warehouse Supervisor,"Manage warehouse operations and staff, overseeing inventory, shipping, and receiving processes, including inventory control, order picking, packing, and distribution. Ensure a safe and efficient working environment, implementing and enforcing warehouse protocols, safety standards, and best practices, while maintaining compliance with OSHA regulations. Optimize storage layout and inventory systems for maximum efficiency and accuracy, using warehouse management systems (WMS) and other tools to manage stock and track shipments"
26,Educational Trainer,"Train employees on various skills and topics, creating and delivering comprehensive training materials and programs, including eLearning modules, workshops, and on-the-job training. Evaluate training effectiveness through assessment tools, surveys, and feedback loops, making adjustments to improve learning outcomes and ensuring knowledge retention. Stay up-to-date on industry trends, training methodologies, and adult learning principles, incorporating innovative approaches and technologies to enhance training programs"
27,Architect,"Design and plan architectural projects, including residential and commercial buildings, by conducting site assessments, conceptualizing layouts, and creating detailed blueprints. Collaborate with construction teams, engineers, interior designers, and clients to develop architectural solutions that meet the project's functional, aesthetic, and regulatory requirements. Create detailed construction documents, specifications, and cost estimates, and actively participate in the construction administration phase to ensure the project is executed according to the design intent"
28,Public Relations Specialist,"Manage public relations efforts and media interactions, including preparing press releases, media pitches, and crisis communication plans. Craft and maintain a positive public image for the company by nurturing relationships with journalists, influencers, and key media outlets. Monitor news and social media for relevant conversations and trends, responding to public relations challenges and opportunities, and measuring the success of PR campaigns through key performance indicators (KPIs)"
29,Cybersecurity Analyst,"Protect company data and systems from cyber threats by monitoring security alerts, performing vulnerability assessments, and responding to security incidents. Analyze security logs and data to identify and mitigate potential risks, vulnerabilities, and breaches. Develop and maintain security policies, procedures, and awareness programs, ensuring that the company's infrastructure is safeguarded against evolving cyber threats"
30,Customer Insights Analyst,"Analyze customer data to identify trends, preferences, and behaviors, using data analytics tools and methods to generate actionable insights for the marketing, product development, and customer service teams. Conduct customer surveys, interviews, and focus groups to gather qualitative data and understand customer sentiment. Collaborate with cross-functional teams to implement customer-centric strategies, optimize customer experience, and increase customer satisfaction through data-driven decision-making and tailored approaches"
